{
  "schemaVersion": 1,
  "corpusVersion": "1.0.0",
  "semanticProfile": "legacy-js-v1",
  "description": "Language-neutral behavioral corpus frozen from the pure-expr TypeScript tests.",
  "legacyTestCount": 182,
  "caseCount": 182,
  "cases": [
    {
      "id": "evaluator.integer-literal",
      "sourceTest": {
        "suite": "evaluator",
        "name": "integer literal",
        "file": "tests/evaluator.test.ts"
      },
      "profile": "legacy-js-v1",
      "checks": [
        {
          "op": "evaluate",
          "source": "42",
          "context": {},
          "options": {},
          "expect": {
            "value": 42
          }
        }
      ]
    },
    {
      "id": "evaluator.float-literal",
      "sourceTest": {
        "suite": "evaluator",
        "name": "float literal",
        "file": "tests/evaluator.test.ts"
      },
      "profile": "legacy-js-v1",
      "checks": [
        {
          "op": "evaluate",
          "source": "3.14",
          "context": {},
          "options": {},
          "expect": {
            "value": 3.14
          }
        }
      ]
    },
    {
      "id": "evaluator.hex-literal",
      "sourceTest": {
        "suite": "evaluator",
        "name": "hex literal",
        "file": "tests/evaluator.test.ts"
      },
      "profile": "legacy-js-v1",
      "checks": [
        {
          "op": "evaluate",
          "source": "0xFF",
          "context": {},
          "options": {},
          "expect": {
            "value": 255
          }
        }
      ]
    },
    {
      "id": "evaluator.octal-literal",
      "sourceTest": {
        "suite": "evaluator",
        "name": "octal literal",
        "file": "tests/evaluator.test.ts"
      },
      "profile": "legacy-js-v1",
      "checks": [
        {
          "op": "evaluate",
          "source": "0o17",
          "context": {},
          "options": {},
          "expect": {
            "value": 15
          }
        }
      ]
    },
    {
      "id": "evaluator.binary-literal",
      "sourceTest": {
        "suite": "evaluator",
        "name": "binary literal",
        "file": "tests/evaluator.test.ts"
      },
      "profile": "legacy-js-v1",
      "checks": [
        {
          "op": "evaluate",
          "source": "0b1010",
          "context": {},
          "options": {},
          "expect": {
            "value": 10
          }
        }
      ]
    },
    {
      "id": "evaluator.bigint-literal",
      "sourceTest": {
        "suite": "evaluator",
        "name": "bigint literal",
        "file": "tests/evaluator.test.ts"
      },
      "profile": "legacy-js-v1",
      "checks": [
        {
          "op": "evaluate",
          "source": "9007199254740993n",
          "context": {},
          "options": {},
          "expect": {
            "value": {
              "$conformance": "bigint",
              "value": "9007199254740993"
            }
          }
        }
      ]
    },
    {
      "id": "evaluator.string-double-quotes",
      "sourceTest": {
        "suite": "evaluator",
        "name": "string double quotes",
        "file": "tests/evaluator.test.ts"
      },
      "profile": "legacy-js-v1",
      "checks": [
        {
          "op": "evaluate",
          "source": "\"hello\"",
          "context": {},
          "options": {},
          "expect": {
            "value": "hello"
          }
        }
      ]
    },
    {
      "id": "evaluator.string-single-quotes",
      "sourceTest": {
        "suite": "evaluator",
        "name": "string single quotes",
        "file": "tests/evaluator.test.ts"
      },
      "profile": "legacy-js-v1",
      "checks": [
        {
          "op": "evaluate",
          "source": "'world'",
          "context": {},
          "options": {},
          "expect": {
            "value": "world"
          }
        }
      ]
    },
    {
      "id": "evaluator.string-escape-sequences",
      "sourceTest": {
        "suite": "evaluator",
        "name": "string escape sequences",
        "file": "tests/evaluator.test.ts"
      },
      "profile": "legacy-js-v1",
      "checks": [
        {
          "op": "evaluate",
          "source": "\"a\\nb\"",
          "context": {},
          "options": {},
          "expect": {
            "value": "a\nb"
          }
        }
      ]
    },
    {
      "id": "evaluator.boolean-true",
      "sourceTest": {
        "suite": "evaluator",
        "name": "boolean true",
        "file": "tests/evaluator.test.ts"
      },
      "profile": "legacy-js-v1",
      "checks": [
        {
          "op": "evaluate",
          "source": "true",
          "context": {},
          "options": {},
          "expect": {
            "value": true
          }
        }
      ]
    },
    {
      "id": "evaluator.boolean-false",
      "sourceTest": {
        "suite": "evaluator",
        "name": "boolean false",
        "file": "tests/evaluator.test.ts"
      },
      "profile": "legacy-js-v1",
      "checks": [
        {
          "op": "evaluate",
          "source": "false",
          "context": {},
          "options": {},
          "expect": {
            "value": false
          }
        }
      ]
    },
    {
      "id": "evaluator.null-literal",
      "sourceTest": {
        "suite": "evaluator",
        "name": "null literal",
        "file": "tests/evaluator.test.ts"
      },
      "profile": "legacy-js-v1",
      "checks": [
        {
          "op": "evaluate",
          "source": "null",
          "context": {},
          "options": {},
          "expect": {
            "value": null
          }
        }
      ]
    },
    {
      "id": "evaluator.undefined-literal",
      "sourceTest": {
        "suite": "evaluator",
        "name": "undefined literal",
        "file": "tests/evaluator.test.ts"
      },
      "profile": "legacy-js-v1",
      "checks": [
        {
          "op": "evaluate",
          "source": "undefined",
          "context": {},
          "options": {},
          "expect": {
            "value": {
              "$conformance": "undefined"
            }
          }
        }
      ]
    },
    {
      "id": "evaluator.regex-literal",
      "sourceTest": {
        "suite": "evaluator",
        "name": "regex literal",
        "file": "tests/evaluator.test.ts"
      },
      "profile": "legacy-js-v1",
      "checks": [
        {
          "op": "evaluate",
          "source": "/abc/gi",
          "context": {},
          "options": {},
          "expect": {
            "value": {
              "$conformance": "regex",
              "source": "abc",
              "flags": "gi"
            }
          }
        }
      ]
    },
    {
      "id": "evaluator.precedence-over",
      "sourceTest": {
        "suite": "evaluator",
        "name": "precedence: * over +",
        "file": "tests/evaluator.test.ts"
      },
      "profile": "legacy-js-v1",
      "checks": [
        {
          "op": "evaluate",
          "source": "2 + 3 * 4",
          "context": {},
          "options": {},
          "expect": {
            "value": 14
          }
        }
      ]
    },
    {
      "id": "evaluator.precedence-grouping-overrides",
      "sourceTest": {
        "suite": "evaluator",
        "name": "precedence: grouping overrides",
        "file": "tests/evaluator.test.ts"
      },
      "profile": "legacy-js-v1",
      "checks": [
        {
          "op": "evaluate",
          "source": "(2 + 3) * 4",
          "context": {},
          "options": {},
          "expect": {
            "value": 20
          }
        }
      ]
    },
    {
      "id": "evaluator.precedence-right-assoc",
      "sourceTest": {
        "suite": "evaluator",
        "name": "precedence: ** right-assoc",
        "file": "tests/evaluator.test.ts"
      },
      "profile": "legacy-js-v1",
      "checks": [
        {
          "op": "evaluate",
          "source": "2 ** 3 ** 2",
          "context": {},
          "options": {},
          "expect": {
            "value": 512
          }
        }
      ]
    },
    {
      "id": "evaluator.precedence-unary-before",
      "sourceTest": {
        "suite": "evaluator",
        "name": "precedence: unary before **",
        "file": "tests/evaluator.test.ts"
      },
      "profile": "legacy-js-v1",
      "checks": [
        {
          "op": "evaluate",
          "source": "-2 ** 2",
          "context": {},
          "options": {},
          "expect": {
            "value": -4
          }
        }
      ]
    },
    {
      "id": "evaluator.precedence-bitwise-arithmetic",
      "sourceTest": {
        "suite": "evaluator",
        "name": "precedence: bitwise < arithmetic",
        "file": "tests/evaluator.test.ts"
      },
      "profile": "legacy-js-v1",
      "checks": [
        {
          "op": "evaluate",
          "source": "1 + 2 | 4",
          "context": {},
          "options": {},
          "expect": {
            "value": 7
          }
        }
      ]
    },
    {
      "id": "evaluator.left-assoc-subtraction",
      "sourceTest": {
        "suite": "evaluator",
        "name": "left-assoc subtraction",
        "file": "tests/evaluator.test.ts"
      },
      "profile": "legacy-js-v1",
      "checks": [
        {
          "op": "evaluate",
          "source": "10 - 3 - 2",
          "context": {},
          "options": {},
          "expect": {
            "value": 5
          }
        }
      ]
    },
    {
      "id": "evaluator.comparison-chains",
      "sourceTest": {
        "suite": "evaluator",
        "name": "comparison chains",
        "file": "tests/evaluator.test.ts"
      },
      "profile": "legacy-js-v1",
      "checks": [
        {
          "op": "evaluate",
          "source": "1 < 2 === true",
          "context": {},
          "options": {},
          "expect": {
            "value": true
          }
        }
      ]
    },
    {
      "id": "evaluator.logical-and-short-circuit",
      "sourceTest": {
        "suite": "evaluator",